{
  "apiVersion": "flowcredit.api/v1",
  "draftId": "finch-contract-healthy-v01",
  "modelConsent": false,
  "draft": {
    "subjectId": "finch-contract-operator-01",
    "label": "Contract Reference AI Operator",
    "periodStart": "2026-08-01",
    "periodEnd": "2026-08-31",
    "assessmentAsOf": "2026-09-01T00:00:00Z",
    "modelTier": "flagship",
    "taskType": "inference",
    "rawTokensM": 80,
    "inputTokensM": 64,
    "outputTokensM": 16,
    "validRatePct": 94,
    "tokenBucketsM": {
      "valid": 75.2,
      "idle": 1.6,
      "duplicate": 1.6,
      "pulse": 0.8,
      "unclassified": 0.8
    },
    "gpuHours": 4200,
    "gpuModel": "h100-equivalent",
    "revenueUsd": 100000,
    "computeSpendUsd": 58000,
    "repaymentRatePct": 96,
    "overdue30Pct": 2,
    "payingCustomers": 168,
    "top5ConcentrationPct": 36,
    "relatedPartyRevenuePct": 8,
    "monthlySeries": [
      { "period": "2026-03", "rawTokensM": 72, "validRatePct": 92, "revenueUsd": 94000, "computeSpendUsd": 55000 },
      { "period": "2026-04", "rawTokensM": 75, "validRatePct": 93, "revenueUsd": 96000, "computeSpendUsd": 56000 },
      { "period": "2026-05", "rawTokensM": 77, "validRatePct": 93, "revenueUsd": 97000, "computeSpendUsd": 56500 },
      { "period": "2026-06", "rawTokensM": 79, "validRatePct": 94, "revenueUsd": 99000, "computeSpendUsd": 57500 },
      { "period": "2026-07", "rawTokensM": 81, "validRatePct": 94, "revenueUsd": 101000, "computeSpendUsd": 59000 },
      { "period": "2026-08", "rawTokensM": 80, "validRatePct": 94, "revenueUsd": 100000, "computeSpendUsd": 58000 }
    ],
    "operatingHistoryDays": 720,
    "dataCoveragePct": 100,
    "R": [64, 65, 63, 67, 68, 66, 70, 71],
    "C": [62, 63, 62, 65, 66, 65, 68, 69],
    "loopWashRatePct": 2,
    "currentExposure": 20000,
    "evidence": [
      {
        "fields": ["periodStart", "periodEnd", "inputTokensM", "outputTokensM", "validRatePct", "revenueUsd", "computeSpendUsd", "monthlySeries"],
        "sourceDomain": "billing",
        "verification": "system_api",
        "observedAt": "2026-09-01T00:00:00Z",
        "coveragePct": 100,
        "referenceHash": "sha256:2f083fd14111819f0f35e9af881a51c4ef09f1ae7c7b2f82391a94f5e3641e23"
      },
      {
        "fields": ["gpuHours", "gpuModel", "R", "C", "dataCoveragePct"],
        "sourceDomain": "gpu_telemetry",
        "verification": "system_api",
        "observedAt": "2026-09-01T00:00:00Z",
        "coveragePct": 100,
        "referenceHash": "sha256:bb88b0840f232612a0e3f21262b51ac0276588dbe90b77e6f101dc3955711508"
      },
      {
        "fields": ["repaymentRatePct", "overdue30Pct", "payingCustomers", "top5ConcentrationPct", "operatingHistoryDays"],
        "sourceDomain": "bank_treasury",
        "verification": "system_api",
        "observedAt": "2026-09-01T00:00:00Z",
        "coveragePct": 100,
        "referenceHash": "sha256:f77056f01a934111be6e16b47fb2826ce4e7780ed13a2afad7cb8d3d297808c7"
      }
    ]
  }
}
